;CELL SUSPENSION ID (Required);CELL SUSPENSION NAME;CELL SUSPENSION DESCRIPTION;NCBI TAXON ID (Required);GENUS SPECIES (Required);GENUS SPECIES ONTOLOGY ID;GENUS SPECIES ONTOLOGY LABEL ONTOLOGY ID;SELECTED CELL TYPE(S);SELECTED CELL TYPE(S) ONTOLOGY ID;SELECTED CELL TYPE(S) ONTOLOGY LABEL ONTOLOGY ID;ESTIMATED CELL COUNT;INPUT SPECIMEN FROM ORGANISM ID (Required);INPUT CELL LINE ID;DISSOCIATION PROTOCOL ID (Required);ENRICHMENT PROTOCOL ID (Required)
;A unique ID for the biomaterial.;A short, descriptive name for the biomaterial that need not be unique.;A general description of the biomaterial.;A taxonomy ID (taxonID) from NCBI.;The scientific binomial name for the species of the suspension.;An ontology term identifier in the form prefix:accession.;The preferred label for the ontology term referred to in the ontology field. This may differ from the user-supplied value in the text field.;The cell type(s) selected to be present in the suspension.;An ontology term identifier in the form prefix:accession.;The preferred label for the ontology term referred to in the ontology field. This may differ from the user-supplied value in the text field.;Estimated number of cells in the suspension.;A unique ID for the biomaterial.;;A unique ID for the protocol.;A unique ID for the protocol.
;;;; For example: 9606;" For example: Homo sapiens; Mus musculus";" For example: NCBITaxon:9606; NCBITaxon:10090";" For example: Homo sapiens; Mus musculus";"Enter the cell type(s) selected for, not the cell type(s) determined to be present post-analysis. For example: bone marrow hematopoietic cell; cardiac muscle cell";" For example: CL:1001610; CL:0000746";" For example: bone marrow hematopoietic cell; cardiac muscle cell";"Enter 1 for well-based assays. For example: 1; 2100";;;Protocol ID should have no spaces.;Protocol ID should have no spaces.
cell_suspension.uuid;cell_suspension.biomaterial_core.biomaterial_id;cell_suspension.biomaterial_core.biomaterial_name;cell_suspension.biomaterial_core.biomaterial_description;cell_suspension.biomaterial_core.ncbi_taxon_id;cell_suspension.genus_species.text;cell_suspension.genus_species.ontology;cell_suspension.genus_species.ontology_label;cell_suspension.selected_cell_types.text;cell_suspension.selected_cell_types.ontology;cell_suspension.selected_cell_types.ontology_label;cell_suspension.estimated_cell_count;specimen_from_organism.biomaterial_core.biomaterial_id;cell_line.biomaterial_core.biomaterial_id;dissociation_protocol.protocol_core.protocol_id;enrichment_protocol.protocol_core.protocol_id
;FILL OUT INFORMATION BELOW THIS ROW;;;;;;;;;;;;;;
0e44628a-552b-4377-a262-26ef6cdfe104;cellsuspension1;Human embryonic Fibroblasts;Fibroblasts isolated from human embryo;9606;Homo sapiens;NCBITaxon:9606;Homo sapiens;Human Embryonic fibroblast;CL:2000042;embryonic fibroblast;;Specimen1;;HEF_Dissociation;
a3352e34-e7ae-4ed0-b580-a10c2f7a3451;cellsuspension2;CD45+ d3 iDCs;Induced Dendritic cells at reprogramming day 3;9606;Homo sapiens;NCBITaxon:9606;Homo sapiens;Reprogrammed dendritic cell;CL:0000451;dendritic cell;;;Cell_line_1;HEF_Dissociation;iDC_d3_Enrichment
906f8f09-deaa-40bb-bf50-27d2336b2dc4;cellsuspension3;CD45+ HLA-DR+ d9 iDCs;Induced Dendritic cells at reprogramming day 9;9606;Homo sapiens;NCBITaxon:9606;Homo sapiens;Reprogrammed dendritic cell;CL:0000451;dendritic cell;;;Cell_line_2;HEF_Dissociation;iDC_d9_Enrichment
