;CELL LINE ID (Required);CELL LINE NAME;CELL LINE DESCRIPTION;NCBI TAXON ID (Required);CELL LINE TYPE (Required);ORGAN MODEL (Required);ORGAN MODEL ONTOLOGY ID;ORGAN MODEL ONTOLOGY LABEL ONTOLOGY ID;GROWTH MEDIUM;CULTURE ENVIRONMENT;CELL TYPE;CELL TYPE ONTOLOGY ID;CELL TYPE ONTOLOGY LABEL ONTOLOGY ID;TISSUE ONTOLOGY ID;TISSUE ONTOLOGY LABEL ONTOLOGY ID;DISEASE;DISEASE ONTOLOGY ID;DISEASE ONTOLOGY LABEL ONTOLOGY ID;GENUS SPECIES (Required);GENUS SPECIES ONTOLOGY ID;GENUS SPECIES ONTOLOGY LABEL ONTOLOGY ID;INPUT SPECIMEN FROM ORGANISM ID (Required);DISSOCIATION PROTOCOL ID (Required);;
;A unique ID for the biomaterial.;A short, descriptive name for the biomaterial that need not be unique.;A general description of the biomaterial.;A taxonomy ID (taxonID) from NCBI.;The type of cell line.;A term that may be associated with an anatomy-related ontology term.;An ontology term identifier in the form prefix:accession.;The preferred label for the ontology term referred to in the ontology field. This may differ from the user-supplied value in the text field.;The solid, liquid, or semi-solid medium used to support growth.;Cell culture environment in which cells are grown.;A term that may be associated with a cell type-related ontology term.;An ontology term identifier in the form prefix:accession.;The preferred label for the ontology term referred to in the ontology field. This may differ from the user-supplied value in the text field.;An ontology term identifier in the form prefix:accession.;The preferred label for the ontology term referred to in the ontology field. This may differ from the user-supplied value in the text field.;A term that may be associated with a disease-related ontology term.;An ontology term identifier in the form prefix:accession.;The preferred label for the ontology term referred to in the ontology field. This may differ from the user-supplied value in the text field.;The scientific binomial name for the species of the cell line.;An ontology term identifier in the form prefix:accession.;The preferred label for the ontology term referred to in the ontology field. This may differ from the user-supplied value in the text field.;A unique ID for the biomaterial.;A unique ID for the protocol.;;
;;;; For example: 9606; For example: Should be one of: primary, immortalized, stem cell, stem cell-derived, induced pluripotent, or synthetic.;" For example: heart; immune system";" For example: UBERON:0000948; UBERON:0002405";" For example: heart; immune system";" For example: human placental cord serum; RPMI 1640 + 2mM Glutamine + 10-20% FBS";" For example: Adherent cell culture; Suspension cell culture";" For example: bone marrow hematopoietic cell; cardiac muscle cell";" For example: CL:1001610; CL:0000746";" For example: bone marrow hematopoietic cell; cardiac muscle cell";" For example: UBERON:0002371; UBERON:0000006";" For example: bone marrow; islet of Langerhans";" For example: type 2 diabetes mellitus; normal";" For example: MONDO:0005148; PATO:0000461";" For example: type 2 diabetes mellitus; normal";" For example: Homo sapiens; Mus musculus";" For example: NCBITaxon:9606; NCBITaxon:10090";" For example: Homo sapiens; Mus musculus";;Protocol ID should have no spaces.;;
cell_line.uuid;cell_line.biomaterial_core.biomaterial_id;cell_line.biomaterial_core.biomaterial_name;cell_line.biomaterial_core.biomaterial_description;cell_line.biomaterial_core.ncbi_taxon_id;cell_line.type;cell_line.model_organ.text;cell_line.model_organ.ontology;cell_line.model_organ.ontology_label;cell_line.growth_conditions.growth_medium;cell_line.growth_conditions.culture_environment;cell_line.cell_type.text;cell_line.cell_type.ontology;cell_line.cell_type.ontology_label;cell_line.tissue.ontology;cell_line.tissue.ontology_label;cell_line.disease.text;cell_line.disease.ontology;cell_line.disease.ontology_label;cell_line.genus_species.text;cell_line.genus_species.ontology;cell_line.genus_species.ontology_label;specimen_from_organism.biomaterial_core.biomaterial_id;dissociation_protocol.protocol_core.protocol_id;;
;FILL OUT INFORMATION BELOW THIS ROW;;;;;;;;;;;;;;;;;;;;;;;;
6a28bd71-9910-47e3-b01c-f9e6fd720341;Cell_line_1;CD45+ d3 iDCs;Induced Dendritic cells at reprogramming day 3;9606;primary;immune system;UBERON:0002405;immune system;Dulbecco’s modified Eagle’s medium supplemented with 10% (v/v) FBS, 2 mM l-glutamine, and antibiotics (penicillin and streptomycin, 10 g/ml);Adherent cell culture;dendritic cell;CL:0000451;dendritic cell;;;normal;PATO:0000461;normal;Homo sapiens;NCBITaxon:9606;Homo sapiens;Specimen1;HEF_Dissociation;;
70054038-cb12-429d-bb37-69185ff1deee;Cell_line_2;CD45+ HLA-DR+ d9 iDCs;Induced Dendritic cells at reprogramming day 9;9606;primary;immune system;UBERON:0002405;immune system;Dulbecco’s modified Eagle’s medium supplemented with 10% (v/v) FBS, 2 mM l-glutamine, and antibiotics (penicillin and streptomycin, 10 g/ml);Adherent cell culture;dendritic cell;CL:0000451;dendritic cell;;;normal;PATO:0000461;normal;Homo sapiens;NCBITaxon:9606;Homo sapiens;Specimen1;HEF_Dissociation;;
