;ENRICHMENT PROTOCOL ID (Required);ENRICHMENT PROTOCOL NAME;ENRICHMENT PROTOCOL DESCRIPTION;PUBLICATION DOI;PROTOCOLS.IO DOI;DOCUMENT FILENAME;ENRICHMENT METHOD (Required);ENRICHMENT METHOD ONTOLOGY ID;ENRICHMENT METHOD ONTOLOGY LABEL ONTOLOGY ID;MARKERS;MINIMUM SIZE SELECTED;MAXIMUM SIZE SELECTED
;A unique ID for the protocol.;A short name for the protocol.;A general description of the protocol.;The publication digital object identifier (doi) for the protocol.;The protocols.io digital object identifier (doi) for the protocol.;A filename of a PDF document containing the details of the protocol.;A term that may be associated with a process-related ontology term.;An ontology term identifier in the form prefix:accession.;The preferred label for the ontology term referred to in the ontology field. This may differ from the user-supplied value in the text field.;A list of markers used to enrich for or against certain cells.;Minimum cell or organelle size passing selection, in microns.;Maximum cell or organelle size passing selection, in microns.
;Protocol ID should have no spaces.;;; For example: 10.1101/193219; For example: 10.17504/protocols.io.mgjc3un; For example: my_cool_protocol.pdf;" For example: enzymatic dissociation; blood draw";" For example: EFO:0009128; EFO:0009121";" For example: enzymatic dissociation; blood draw";"Format as a space-delimited list of markers with +/- where + means enriched for and - means enriched against. For example: CD4+ CD8-; HLA-G+"; For example: 70; For example: 90
enrichment_protocol.uuid;enrichment_protocol.protocol_core.protocol_id;enrichment_protocol.protocol_core.protocol_name;enrichment_protocol.protocol_core.protocol_description;enrichment_protocol.protocol_core.publication_doi;enrichment_protocol.protocol_core.protocols_io_doi;enrichment_protocol.protocol_core.document;enrichment_protocol.method.text;enrichment_protocol.method.ontology;enrichment_protocol.method.ontology_label;enrichment_protocol.markers;enrichment_protocol.minimum_size;enrichment_protocol.maximum_size
;FILL OUT INFORMATION BELOW THIS ROW;;;;;;;;;;;
1ec52bc9-6a1d-438f-8979-45c98a862757;tcell_negative_selection;;"T cell enrichment using magnetic negative selection for CD3+ T cells (MojoSort Human CD3+ T cell Isolation Kit; BioLegend), followed by a dead cell removal kit (Miltenyi Biotec), resulting in 80-90% purity.";;;;magnetic negative selection;EFO:0009109;magnetic affinity cell sorting;CD3+;;
